asin,title,imgUrl,productURL,stars,reviews,price,listPrice,category_id,isBestSeller,boughtInLastMonth
B07JN9LJN3,"Boy's 6-Piece Suit Set - Includes Suit Jacket, Dress Pants, Matching Vest, White Dress Shirt, Neck Tie & Bow Tie",https://m.media-amazon.com/images/I/61++ezVRjCL._AC_UL320_.jpg,https://www.amazon.com/dp/B07JN9LJN3,4.3,1007,64.99,0.0,84,False,0
B097LR9681,Boy Plaid Slim Fit Formal Suit Set 4 Pieces Dresswear,https://m.media-amazon.com/images/I/51dggaGyfoS._AC_UL320_.jpg,https://www.amazon.com/dp/B097LR9681,4.5,18,45.99,0.0,84,False,0
B06Y3ZL3XY,Boys 3Pcs Clothing Sets Cotton Long Sleeve Bowtie Shirts +Vest +Pants Casual Suit,https://m.media-amazon.com/images/I/61ZK5DBuz4L._AC_UL320_.jpg,https://www.amazon.com/dp/B06Y3ZL3XY,4.4,761,22.99,0.0,84,False,0
B0BLH3DPR1,3 Sets Boys Thermal Underwear Warm Soft Thermal Top and Long Johns for Boys,https://m.media-amazon.com/images/I/71js0s25+gL._AC_UL320_.jpg,https://www.amazon.com/dp/B0BLH3DPR1,4.4,179,24.99,0.0,84,False,0
B0846L9YGB,"Boys' and Toddler Underwear, Comfort Flex Waistband Boxer Briefs, Multiple Packs Available",https://m.media-amazon.com/images/I/81mSG78BFqL._AC_UL320_.jpg,https://www.amazon.com/dp/B0846L9YGB,4.7,40635,14.99,0.0,84,True,8000
B0BHX6LDVW,"boys Hanes Toddler Boys' Potty Trainer Underwear, Boxer Briefs & Briefs Available, 6-pack",https://m.media-amazon.com/images/I/81Cc5Ej2ELL._AC_UL320_.jpg,https://www.amazon.com/dp/B0BHX6LDVW,4.7,617,11.98,13.0,84,False,3000
B0BHX4VPHL,"Toddler Boys' Potty Trainer Underwear, Boxer Briefs & Briefs Available, 6-Pack",https://m.media-amazon.com/images/I/81pKploAIuL._AC_UL320_.jpg,https://www.amazon.com/dp/B0BHX4VPHL,4.8,490,11.98,13.0,84,False,2000
B082WWQ2P6,"Toddler Boys' Undershirts, White T-Shirts for Babies, Crew Tees, 5-Pack",https://m.media-amazon.com/images/I/61agx0fOxgS._AC_UL320_.jpg,https://www.amazon.com/dp/B082WWQ2P6,4.7,3879,9.99,0.0,84,False,3000
B07961JYWP,"Boys' Long-Sleeve Shirts, Pack of 3",https://m.media-amazon.com/images/I/91D9keJyq0L._AC_UL320_.jpg,https://www.amazon.com/dp/B07961JYWP,4.8,16238,22.8,23.9,84,True,1000
B075XSN413,"Toddler Boys' Pull-On Denim Pant, Pack of 2",https://m.media-amazon.com/images/I/A1nwcBIwosL._AC_UL320_.jpg,https://www.amazon.com/dp/B075XSN413,4.7,6927,28.5,0.0,84,False,800
B0BHX9VK2F,"Toddler Boys' Underwear, Pure Comfort 100% Cotton Boxer Briefs & Briefs Available, 10-Pack",https://m.media-amazon.com/images/I/71Ia+yE8mkL._AC_UL320_.jpg,https://www.amazon.com/dp/B0BHX9VK2F,4.7,567,9.99,14.0,84,False,2000
B00AJ34JQE,Boys' Steens Mountain Ii Fleece,https://m.media-amazon.com/images/I/61E68ZN8Z3L._AC_UL320_.jpg,https://www.amazon.com/dp/B00AJ34JQE,4.8,11128,25.05,36.0,84,True,800
B00GIIIT1U,Boys' Tag Free Cotton Briefs (Assorted Colors),https://m.media-amazon.com/images/I/8169qs18SIL._AC_UL320_.jpg,https://www.amazon.com/dp/B00GIIIT1U,4.7,21838,9.94,0.0,84,True,2000
B08P54W93C,Boys' Multipack Basic Straight Leg Jeans,https://m.media-amazon.com/images/I/911EZ2IUsaL._AC_UL320_.jpg,https://www.amazon.com/dp/B08P54W93C,4.6,4838,44.19,47.99,84,False,400
B08Y19DTV2,Boys' Pull on Cargo Pants,https://m.media-amazon.com/images/I/61r1xiZt9VL._AC_UL320_.jpg,https://www.amazon.com/dp/B08Y19DTV2,4.7,15400,59.99,67.99,84,False,200
B09DRM97JQ,Boys' Canvas Insulated Hooded Active Jac,https://m.media-amazon.com/images/I/91QCGmX5TgL._AC_UL320_.jpg,https://www.amazon.com/dp/B09DRM97JQ,4.9,390,49.99,0.0,84,False,300
B0BKFZKW1P,Boys' Fleece Lined Thermal Underwear Set Winter Kids’ Top & Long Johns Base Layer Shirt & Pants for Boys,https://m.media-amazon.com/images/I/71bAXirsa4L._AC_UL320_.jpg,https://www.amazon.com/dp/B0BKFZKW1P,4.7,26,16.99,0.0,84,False,0
B06Y27NBNM,Boys 3Pcs Clothing Sets Cotton Long Sleeve Bowtie Shirts +Vest +Pants Casual Suit,https://m.media-amazon.com/images/I/61Yc5nJV0jL._AC_UL320_.jpg,https://www.amazon.com/dp/B06Y27NBNM,4.5,846,22.99,0.0,84,False,0
B00O2O3APW,BOY'S Dress Vest & NeckTie Solid EMERALD GREEN Color Neck Tie Set,https://m.media-amazon.com/images/I/618D-LcnuwL._AC_UL320_.jpg,https://www.amazon.com/dp/B00O2O3APW,4.5,134,28.55,0.0,84,False,0
B07V26S81T,Boys Suits 5 Piece Slim Fit Suit for Kids Formal Ring Bearer Suits,https://m.media-amazon.com/images/I/51xldJ1OpqL._AC_UL320_.jpg,https://www.amazon.com/dp/B07V26S81T,4.5,903,68.88,0.0,84,False,0
B07DC8BR3B,"Pampers Swaddlers Diapers Size 4, 150 count - Disposable Diapers",https://m.media-amazon.com/images/I/61SP6lMLNSL._AC_UL320_.jpg,https://www.amazon.com/dp/B07DC8BR3B,4.8,0,55.94,0.0,129,True,30000
B007C8NJCE,"Huggies Natural Care Sensitive Baby Wipes, Unscented, Hypoallergenic, 99% Purified Water, 8 Flip-Top Packs (448 Wipes Total)",https://m.media-amazon.com/images/I/81hiYf+pv7L._AC_UL320_.jpg,https://www.amazon.com/dp/B007C8NJCE,4.8,0,13.7,20.16,129,True,20000
B00GAGC9B6,"Pampers Sensitive Water Based Hypoallergenic and Unscented Baby Wipes, 56 count Baby Wipes (Packaging May Vary)",https://m.media-amazon.com/images/I/71wUkuITGiL._AC_UL320_.jpg,https://www.amazon.com/dp/B00GAGC9B6,4.8,0,2.34,0.0,129,False,10000
B06XPHR7DF,"Lansinoh Stay Dry Disposable Nursing Pads, Soft and Super Absorbent Breast Pads, Breastfeeding Essentials for Moms, 200 Count",https://m.media-amazon.com/images/I/71e0wNZ3ZQL._AC_UL320_.jpg,https://www.amazon.com/dp/B06XPHR7DF,4.8,0,19.89,23.39,129,True,10000
B01BDQDIJ4,"Munchkin® Arm & Hammer Puck Baking Soda Cartridge, Lavender Scent",https://m.media-amazon.com/images/I/71atN-1H6iL._AC_UL320_.jpg,https://www.amazon.com/dp/B01BDQDIJ4,4.5,0,4.48,6.29,129,False,10000
B00ZT38BIQ,"Ubbi Disposable Diaper Pail Plastic Bags, Value Pack, 75 Count, 13-Gallon Bags",https://m.media-amazon.com/images/I/81UDWgUNV5L._AC_UL320_.jpg,https://www.amazon.com/dp/B00ZT38BIQ,4.9,0,19.99,0.0,129,False,10000
B09HY9P5HW,"Luvs Diapers Size 5, 172 count - Disposable Diapers",https://m.media-amazon.com/images/I/6108NQSIhdL._AC_UL320_.jpg,https://www.amazon.com/dp/B09HY9P5HW,4.6,0,39.94,0.0,129,False,10000
B01IZ5F6T6,"Pampers Pure Protection Diapers Size 5, 132 count - Disposable Diapers",https://m.media-amazon.com/images/I/61ZMDwA4xzL._AC_UL320_.jpg,https://www.amazon.com/dp/B01IZ5F6T6,4.8,0,65.47,0.0,129,False,8000
B07K2TKK26,"Ubbi Disposable Diaper Sacks, Lavender Scented, Easy-To-Tie Tabs, Diaper Disposal or Pet Waste Bags, 200 Count",https://m.media-amazon.com/images/I/61K8sYPwOAL._AC_UL320_.jpg,https://www.amazon.com/dp/B07K2TKK26,4.7,0,7.99,0.0,129,False,9000
B08VLB4NVP,"Pampers Cruisers 360 Diapers Size 7, 88 count - Disposable Diapers",https://m.media-amazon.com/images/I/71Ya1ohTWkL._AC_UL320_.jpg,https://www.amazon.com/dp/B08VLB4NVP,4.8,0,55.94,0.0,129,False,7000
B08YKVJTDH,"WaterWipes Plastic-Free Textured Clean, Toddler & Baby Wipes, 99.9% Water Based Wipes, Unscented & Hypoallergenic for Sensitive Skin, 720 Count (12 packs), Packaging May Vary",https://m.media-amazon.com/images/I/61Qfq8egg1L._AC_UL320_.jpg,https://www.amazon.com/dp/B08YKVJTDH,4.7,0,38.23,45.99,129,False,9000
B00BH0QPUG,DEKOR Plus Diaper Pail Refills | 4 Count | Most Economical Refill System | Quick & Easy to Replace | No Preset Bag Size – Use Only What You Need | Exclusive End-of-Liner Marking | Baby Powder Scent,https://m.media-amazon.com/images/I/61Js24T0evL._AC_UL320_.jpg,https://www.amazon.com/dp/B00BH0QPUG,4.8,0,26.99,29.95,129,False,5000
B073CP9NJS,"Compatible with Diaper Genie Pails, 8-Pack, 2160 count",https://m.media-amazon.com/images/I/712cxGkl3RL._AC_UL320_.jpg,https://www.amazon.com/dp/B073CP9NJS,4.7,0,23.99,0.0,129,True,6000
B0795WF49L,"Pampers Splashers Swim Diapers Size M, 18 Count",https://m.media-amazon.com/images/I/81YxnKcfdZL._AC_UL320_.jpg,https://www.amazon.com/dp/B0795WF49L,4.8,0,9.94,0.0,129,False,7000
B08871T9QP,Pampers Ninjamas Nighttime Bedwetting Underwear Girls S/M (38-65 lbs) 44 Count,https://m.media-amazon.com/images/I/8157wqqmi8L._AC_UL320_.jpg,https://www.amazon.com/dp/B08871T9QP,4.6,0,27.96,0.0,129,False,5000
B07SYCRDR8,"Amazon Brand - Mama Bear Gentle Touch Diapers, Hypoallergenic, Size 7, 80 Count (4 packs of 20), White",https://m.media-amazon.com/images/I/71EyJUbadqL._AC_UL320_.jpg,https://www.amazon.com/dp/B07SYCRDR8,4.3,0,27.05,31.82,129,False,4000
B01DQID0N6,Diaper Genie Carbon Filter (4-Pack) | Diaper Pail Odor Eliminator & Deodorizer | Compatible with the Diaper Genie Complete and Expressions Pail,https://m.media-amazon.com/images/I/619FeKlzhRL._AC_UL320_.jpg,https://www.amazon.com/dp/B01DQID0N6,4.5,0,7.11,0.0,129,False,4000
B08KKVMNMJ,"Colgate Kids Battery Powered Toothbrush, Unicorn, Extra Soft Toothbrush, Ages 3 and Up, 1 Pack",https://m.media-amazon.com/images/I/71diTLLX3dL._AC_UL320_.jpg,https://www.amazon.com/dp/B08KKVMNMJ,4.7,0,4.98,5.99,129,True,4000
B01NBNG19Y,"The Honest Company Clean Conscious Overnight Diapers | Plant-Based, Sustainable | Sleepy Sheep | Club Box, Size 6 (35+ lbs), 42 Count",https://m.media-amazon.com/images/I/61JYwhiDWiL._AC_UL320_.jpg,https://www.amazon.com/dp/B01NBNG19Y,4.4,0,29.97,0.0,129,False,4000
B097NRRRNT,"Johnson's Baby Skin Nourishing Moisture Baby Body Wash With Vanilla & Oat Scents, Hypoallergenic & Tear Free Baby Bath Wash, Paraben-, Dye-, Sulfate & Phthalate-Free, 20.3 fl. oz",https://m.media-amazon.com/images/I/615B93KB7-L._AC_UL320_.jpg,https://www.amazon.com/dp/B097NRRRNT,4.7,0,6.28,0.0,129,False,4000
B0B81LSL6Q,"Corner Shower Caddy, 2 Pack Adhesive Shower Corner Organizer Shelves, No Drilling Stainless Steel Shower Storage Rack with Hooks&Toothpaste Holder for Bathroom, Dorm and Kitchen",https://m.media-amazon.com/images/I/71qo5eAZRdL._AC_UL320_.jpg,https://www.amazon.com/dp/B0B81LSL6Q,4.7,0,19.99,0.0,163,False,10000
B09LYGMTVX,"Shower Curtain Hooks Rings, Rust-Resistant for Bathroom Shower Rods Shower Hooks - Set of 12, Chrome",https://m.media-amazon.com/images/I/61KWmht+ltL._AC_UL320_.jpg,https://www.amazon.com/dp/B09LYGMTVX,4.5,0,3.99,9.99,163,False,8000
B09C67QZ2D,"SONORO KATE Bathroom Rug 32""×20"", Non-Slip Bath Mat, Soft Cozy Shaggy Durable Thick Chenille Bath Rugs for Bathroom,Easier to Dry, Plush Rugs for Bathtubs, Rain Showers and Under The Sink (Dark Grey)",https://m.media-amazon.com/images/I/81TAObJVrBL._AC_UL320_.jpg,https://www.amazon.com/dp/B09C67QZ2D,4.6,0,14.99,0.0,163,False,7000
B07L28V39Q,"INEVIFIT Bathroom Scale, Highly Accurate Digital Bathroom Body Scale, Measures Weight up to 400 lbs. Includes Batteries",https://m.media-amazon.com/images/I/71ibxVZi9BL._AC_UL320_.jpg,https://www.amazon.com/dp/B07L28V39Q,4.8,0,44.99,0.0,163,False,9000
B07Q8Y8GWN,"JASAI 18 Oz Clear Glass Soap Dispenser with Rust Proof Stainless Steel Pump, Refillable Liquid Hand Soap Dispenser for Bathroom, Premium Kitchen Soap Dispenser (Clear).",https://m.media-amazon.com/images/I/61S4zvDangL._AC_UL320_.jpg,https://www.amazon.com/dp/B07Q8Y8GWN,4.6,0,8.99,17.99,163,False,5000
B07TXBPBF4,"smiry Luxury Chenille Bath Rug, Extra Soft and Absorbent Shaggy Bathroom Mat Rugs, Machine Washable, Non-Slip Plush Carpet Runner for Tub, Shower, and Bath Room(24''x16'', Black)",https://m.media-amazon.com/images/I/81Y8HSYNloL._AC_UL320_.jpg,https://www.amazon.com/dp/B07TXBPBF4,4.5,0,8.99,11.99,163,False,6000
B08FWQBQS5,"Matte Black Toilet Paper Holder SUS304 Stainless Steel, Modern Round Tissue Roll Holders Wall Mount, Toilet Paper Roll Dispenser Bathroom 5 inch TP Holder for Kitchen Washroom",https://m.media-amazon.com/images/I/51OWLzGEfAL._AC_UL320_.jpg,https://www.amazon.com/dp/B08FWQBQS5,4.6,0,9.99,0.0,163,False,5000
B004ZLAGJK,OXO Good Grips Soap Dispensing Palm Brush Storage Set,https://m.media-amazon.com/images/I/71ixBEDC2HL._AC_UL320_.jpg,https://www.amazon.com/dp/B004ZLAGJK,4.7,0,11.99,0.0,163,False,5000
B07VN49QF5,"Utopia Towels - Luxurious Jumbo Bath Sheet 2 Piece - 600 GSM 100% Ring Spun Cotton Highly Absorbent and Quick Dry Extra Large Bath Towel - Super Soft Hotel Quality Towel (35 x 70 Inches, Grey)",https://m.media-amazon.com/images/I/A1WIbLZAWdL._AC_UL320_.jpg,https://www.amazon.com/dp/B07VN49QF5,4.5,0,29.99,39.99,163,False,4000
B06Y2FS8FK,"Madesmart 2-Tier Plastic Multipurpose Organizer with Divided Slide-Out Storage Bins, Under Sink and Cabinet Organizer Rack, Frost",https://m.media-amazon.com/images/I/61r05gGdJXL._AC_UL320_.jpg,https://www.amazon.com/dp/B06Y2FS8FK,4.6,0,17.99,22.99,163,True,3000
B07Z7C6P6V,"YINENN Bath Tub Shower Stall Mats 31x15.5 Inch Non-Slip and Latex Free, Bathtub Mat with Suction Cups, Machine Washable Bathroom Mats with Drain Holes (Clear)",https://m.media-amazon.com/images/I/71nxFhDeXJL._AC_UL320_.jpg,https://www.amazon.com/dp/B07Z7C6P6V,4.5,0,9.97,19.99,163,False,4000
B07QBZGQ6Y,"AquaBliss HD Multi Stage Shower Filter Replacement Cartridge - 48x Heavy Duty Detox Power. Kiss Itching, Breakage & Dullness Goodbye. Reduce Rust, Chemicals, Chlorine, Toxins. SFC500 Filter Cartridge",https://m.media-amazon.com/images/I/61WD4AkmJaL._AC_UL320_.jpg,https://www.amazon.com/dp/B07QBZGQ6Y,4.6,0,18.99,29.95,163,False,0
B06XKK5RDW,"Luigi's Sink and Drain Plunger for Bathrooms, Kitchens, Sinks, Baths and Showers. Small and Powerful, Commercial Style 'Plumbers Plunger' with Large Bellows",https://m.media-amazon.com/images/I/617FkvQFW6L._AC_UL320_.jpg,https://www.amazon.com/dp/B06XKK5RDW,4.5,0,14.99,0.0,163,False,3000
B07FPQZG6V,"Gorilla Grip Bath Rug 24x17, Thick Soft Absorbent Chenille, Rubber Backing Quick Dry Microfiber Mats, Machine Washable Rugs for Shower Floor, Bathroom Runner Bathmat Accessories Decor, Grey",https://m.media-amazon.com/images/I/715r2qeyaWL._AC_UL320_.jpg,https://www.amazon.com/dp/B07FPQZG6V,4.4,0,10.89,29.99,163,False,7000
B08XZ32W1Y,"OLANLY Luxury Bathroom Rug Mat 30x20, Extra Soft and Absorbent Microfiber Bath Rugs, Non-Slip Plush Shaggy Bath Carpet, Machine Wash Dry, Bath Mats for Bathroom Floor, Tub and Shower, Grey",https://m.media-amazon.com/images/I/81AFxaQnZXL._AC_UL320_.jpg,https://www.amazon.com/dp/B08XZ32W1Y,4.4,0,18.99,25.99,163,True,3000
B09DSVYN6F,"ALYVIA SPRING Extra Long Fabric Shower Curtain Liner Waterproof - 72"" x 84"", Soft & Lightweight XL Shower Curtain with Magnets, Machine Washable - 72x84, White",https://m.media-amazon.com/images/I/61N3LuiqNKL._AC_UL320_.jpg,https://www.amazon.com/dp/B09DSVYN6F,4.6,0,14.95,21.99,163,False,3000
B095PYHJ2T,Gallon Pump Dispenser - for Plastic or Glass Bottles – Heavy-Duty Leak Proof for Commercial and Household Use - Plastic Pump for 1 Gallon Jug  – Non-BPA Plastic (Pack of 2),https://m.media-amazon.com/images/I/71uhhC9A9wS._AC_UL320_.jpg,https://www.amazon.com/dp/B095PYHJ2T,4.5,0,7.97,11.99,163,False,2000
B09YR2ZH1F,"Stone Bath Mat - Non-Slip Fast-Drying Mat for Kitchen Counter, Tub & Bathroom Floor - Super Absorbent Diatomaceous Earth Shower Mat - Elegant Home Decor & Modern Accessories - Gray 23.5x15”",https://m.media-amazon.com/images/I/710f6SOkF+L._AC_UL320_.jpg,https://www.amazon.com/dp/B09YR2ZH1F,4.4,0,49.99,0.0,163,False,2000
B08QVLH26Q,"NearMoon Bathroom Toilet Paper Holder, Premium SUS304 Stainless Steel Rustproof Wall Mounted Toilet Roll Holder for Bathroom, Kitchen, Washroom (1 Pack, Brushed Nickel)",https://m.media-amazon.com/images/I/51S2eyDrcaL._AC_UL320_.jpg,https://www.amazon.com/dp/B08QVLH26Q,4.4,0,7.19,7.99,163,False,2000
B08D91FV4R,"Metal Shower Curtain Hooks，Set of 12 Rings，Rust Resistant S Shaped Hooks Hangers for Kitchen Utensils, Clothing, Towels, etc. (Black)",https://m.media-amazon.com/images/I/61Zl5uq0s+L._AC_UL320_.jpg,https://www.amazon.com/dp/B08D91FV4R,4.7,0,6.99,7.65,163,False,2000
B0B9JPWSC5,"iHaHa Fire Truck Toys for 1 2 3 4 5 6 Years Old Boys Toddler, 5 in 1 Kids Carrier Toy Birthday, Car Friction Power Toys with Light Sound",https://m.media-amazon.com/images/I/81nq8H2IlyL._AC_UL320_.jpg,https://www.amazon.com/dp/B0B9JPWSC5,3.9,1621,26.99,0.0,270,False,600
B0BSRFLM1P,"LEGO DUPLO Town Recycling Truck 10987 Building Toy Set, Learn Through Play with This STEM Creative Birthday Gift for Toddlers, Boys, Girls Ages 2+, Comes with 3 Sorting Bins for Recycling",https://m.media-amazon.com/images/I/81ZYY0YexRL._AC_UL320_.jpg,https://www.amazon.com/dp/B0BSRFLM1P,5.0,4,19.99,0.0,270,False,0
B0BJ2G7XZY,"bravokids LCD Writing Tablet for Kids, 8.5 Inch Toddler Doodle Board Drawing Tablet, Educational and Learning Toys Unicorn Toys, Christmas Birthday Gifts for 3 4 5 6 7 Year Old Girls Boys (Purple)",https://m.media-amazon.com/images/I/71KE2YR41zL._AC_UL320_.jpg,https://www.amazon.com/dp/B0BJ2G7XZY,4.6,287,18.99,26.99,270,False,0
B0BGLTYW59,"Magnetic Tiles Kids Toys STEM Magnet Toys for Toddler Magnetic Blocks Building Toys Preschool Learning Sensory Montessori Toys for 3+ Year Old Boys and Girls, Safe Creativity Toddler Kids Toys",https://m.media-amazon.com/images/I/81HEynVTL3L._AC_UL320_.jpg,https://www.amazon.com/dp/B0BGLTYW59,4.8,916,19.99,34.99,270,False,9000
B0BK98XBVM,"yiyisibao Magnet Toys for 3 Year Old Boys & Girls, Magnetic Blocks STEM Learning Educational Building Blocks for Kids Ages 4-8, Toddler Toys 40 PCS Montessori Toys for 2 Year Old Boys",https://m.media-amazon.com/images/I/71Xycvf4kyL._AC_UL320_.jpg,https://www.amazon.com/dp/B0BK98XBVM,4.6,27,19.99,0.0,270,False,300
B08FQX6RNJ,"Drum Set for Kids with 2 Drum Sticks and Microphone, Musical Toys Gift for Toddlers…",https://m.media-amazon.com/images/I/71NyvEnFI7L._AC_UL320_.jpg,https://www.amazon.com/dp/B08FQX6RNJ,4.3,1066,64.99,0.0,270,False,200
B09QQ5WPVM,"Kiddiworld Dinosaur Toys for 3 4 5 Year Old Boys Gifts, Dinosaurs Toys for Kids 3-5-7, Dino Figures Activity Play Mat Christmas Birthday Gifts for Girls Toddler Toys Age 2-4",https://m.media-amazon.com/images/I/81nJriec0SL._AC_UL320_.jpg,https://www.amazon.com/dp/B09QQ5WPVM,4.6,1481,25.99,35.99,270,False,3000
B01COSEDKS,VTech Drill and Learn Toolbox,https://m.media-amazon.com/images/I/71p8G5z0YSL._AC_UL320_.jpg,https://www.amazon.com/dp/B01COSEDKS,4.7,14089,24.99,0.0,270,False,2000
B0B2RF8T4G,"FNJO Magnetic Tiles, 100PCS Building Blocks, Magnets Building Set, STEM Toys Christmas Toy Gift for Kids Boys and Girls",https://m.media-amazon.com/images/I/81vKBSNHAcL._AC_UL320_.jpg,https://www.amazon.com/dp/B0B2RF8T4G,4.8,1150,49.99,0.0,270,False,0
B0B23JHKTK,"Busy Board - Montessori Toys for 2 Year Old Girl Bithday Gift - 7 in 1 Preschool Learning Activities with Life Skill, Alphabet, Number, Shape, Color, Animal, Weather - Toddler Travel Toys",https://m.media-amazon.com/images/I/81hcIJU+MhL._AC_UL320_.jpg,https://www.amazon.com/dp/B0B23JHKTK,4.6,1299,29.99,39.99,270,False,5000
B082KFTF41,"KOKODI LCD Writing Tablet, 10 Inch Colorful Toddler Doodle Board Drawing Tablet, Erasable Reusable Electronic Drawing Pads, Educational and Learning Toy for 3-6 Years Old Boy and Girls",https://m.media-amazon.com/images/I/71JXJ0I9e-L._AC_UL320_.jpg,https://www.amazon.com/dp/B082KFTF41,4.5,28861,19.99,29.99,270,False,3000
B07GKWLBN2,Water Doodle Mat - Kids Painting Writing Color Doodle Drawing Mat Toy Bring Magic Pens Educational Toys for Age 2 3 4 5 6 7 Year Old Girls Boys Age Toddler Gift,https://m.media-amazon.com/images/I/81yu8G68eTL._AC_UL320_.jpg,https://www.amazon.com/dp/B07GKWLBN2,4.5,26963,25.99,37.99,270,False,7000
B0C2CP3LTQ,"iHaHa Airplane Toys with Toy Car Track Set, Airplane Toys for 2+ 3 Year Old, Garage Parking Lot Playset with 14 Road Signs 4 Inertial Cars 1 Map, Toddler Boy Toys Birthday Gift for 2 3 4 5 6 Years Old",https://m.media-amazon.com/images/I/81jRSO1jg8L._AC_UL320_.jpg,https://www.amazon.com/dp/B0C2CP3LTQ,3.6,16,32.99,0.0,270,False,50
B09HFHXKJ5,"Orchard Toys Moose, Farmyard Heads & Tails Game. A First Matching Activity That develops into a Fun Game. 24 Chunky Cards. Age 18 Months+. 1-4 Players",https://m.media-amazon.com/images/I/815dZ3BKOTL._AC_UL320_.jpg,https://www.amazon.com/dp/B09HFHXKJ5,4.7,287,8.79,9.99,270,False,900
B0C7KYG7DW,"JOYIN Carrier Truck Toys for Kids, 12 Die-Cast Metal Toy Cars with 2 Launchers, Foldable Toy Car Track with Lights & Sounds for Boys, Racing Car for Kids Ages 3-5",https://m.media-amazon.com/images/I/91hoeH5b+YL._AC_UL320_.jpg,https://www.amazon.com/dp/B0C7KYG7DW,4.4,29,25.99,0.0,270,False,1000
B0BRZ3L586,"19 in 1 Dinosaur Truck Toys for Kids 3-5,Tyrannosaurus Car Toy with 15 Dino Figures,Large Activity Play Mat, Dinosaur Eggs, Dinosaur Play Set for Boys and Girls,Christmas Xmax,Stocking Stuffers",https://m.media-amazon.com/images/I/81d8c3QPCxL._AC_UL320_.jpg,https://www.amazon.com/dp/B0BRZ3L586,4.5,252,19.99,22.99,270,False,100
B0858LSYY1,"LEGO DUPLO Town Truck & Tracked Excavator Construction Vehicle 10931 Toy for Toddlers 2-4 Years Old Girls & Boys, Fine Motor Skills Development and Learning Toy",https://m.media-amazon.com/images/I/819cX0+kuLL._AC_UL320_.jpg,https://www.amazon.com/dp/B0858LSYY1,4.9,5605,15.99,19.99,270,False,6000
B08JQ9K7HS,Nicmore Toddler Toys Car for Boys: Kids Toys for 1 2 3 4 Year Old Boys Girls | Carrier Toy Trucks | Toddler Toys Age 1-2 2-4 Baby Toys 12-18 Months Birthday Kids Gift,https://m.media-amazon.com/images/I/81G88Gum-1L._AC_UL320_.jpg,https://www.amazon.com/dp/B08JQ9K7HS,4.5,6292,26.99,35.99,270,False,1000
B0BDL5BSW9,"Pretend Makeup Kit for Toddlers Girls, Kids Pretend Play Makeup Set for Little Girls, Fake Toy Makeup Set with Cosmetic Case & Jewelry Set, Present Gift for Kids Girls Age 3 4 5+ ( Fake Makeup )",https://m.media-amazon.com/images/I/71M0sVB5BOL._AC_UL320_.jpg,https://www.amazon.com/dp/B0BDL5BSW9,4.6,257,17.99,20.99,270,False,300
B09MVMTG3D,"iHaHa Toy Trucks Car for 1 2 3 4 5 Year Old Toddlers Boys, 5 in 1 Carrier Truck Car Construction Vehicles Toys for Kids Boys Girls Toddlers Christmas Birthday Gifts, Car Trucks Toys with Light Sound",https://m.media-amazon.com/images/I/71ttuVTXTyL._AC_UL320_.jpg,https://www.amazon.com/dp/B09MVMTG3D,3.9,1962,26.99,0.0,270,False,700
